"url","name"
"patra193111931271/","POST AND TELEGRAPH RATES ACT 1931 (NO. 1, 1931)"
"weba193121931278/","WINE EXPORT BOUNTY ACT 1931 (NO. 2, 1931)"
"da193131931180/","DISTILLATION ACT 1931 (NO. 3, 1931)"
"sofa193141931298/","SOLAR OBSERVATORY FUND ACT 1931 (NO. 4, 1931)"
"nta193151931443/","NORTHERN TERRITORY (ADMINISTRATION) ACT 1931 (NO. 5, 1931)"
"cba193161931202/","COMMONWEALTH BANK ACT 1931 (NO. 6, 1931)"
"nta2193171931470/","NORTHERN TERRITORY (ADMINISTRATION) ACT (NO 2) 1931 (NO. 7, 1931)"
"sa119313281931178/","SUPPLY ACT (NO 1) 1931-32 (NO. 8, 1931)"
"soga193191931383/","SEAT OF GOVERNMENT (ADMINISTRATION) ACT 1931 (NO. 9, 1931)"
"fea1931101931194/","FINANCIAL EMERGENCY ACT 1931 (NO. 10, 1931)"
"iaopaa1931111931424/","INVALID AND OLD-AGE PENSIONS APPROPRIATION ACT 1931 (NO. 11, 1931)"
"la193112193186/","LOAN ACT 1931 (NO. 12, 1931)"
"ctp1931131931308/","CUSTOMS TARIFF (CANADIAN PREFERENCE) 1931 (NO. 13, 1931)"
"dcaa1931141931278/","DEBT CONVERSION AGREEMENT ACT 1931 (NO. 14, 1931)"
"gba1931151931173/","GOLD BOUNTY ACT 1931 (NO. 15, 1931)"
"aaba193132161931388/","APPROPRIATION (WORKS AND BUILDINGS) ACT 1931-32 (NO. 16, 1931)"
"aa193132171931203/","APPROPRIATION ACT 1931-32 (NO. 17, 1931)"
"cdca1931181931329/","COMMONWEALTH DEBT CONVERSION ACT 1931 (NO. 18, 1931)"
"saga1931191931274/","SOUTH AUSTRALIA GRANT ACT 1931 (NO. 19, 1931)"
"waga1931201931293/","WESTERN AUSTRALIA GRANT ACT 1931 (NO. 20, 1931)"
"cpsa1931211931309/","COMMONWEALTH PUBLIC SERVICE ACT 1931 (NO. 21, 1931)"
"fara1931221931155/","FEDERAL AID ROADS ACT 1931 (NO. 22, 1931)"
"itaa1931231931267/","INCOME TAX ASSESSMENT ACT 1931 (NO. 23, 1931)"
"ita1931241931143/","INCOME TAX ACT 1931 (NO. 24, 1931)"
"staa11931251931292/","SALES TAX ASSESSMENT ACT (NO 1) 1931 (NO. 25, 1931)"
"sta11931261931168/","SALES TAX ACT (NO 1) 1931 (NO. 26, 1931)"
"staa21931271931292/","SALES TAX ASSESSMENT ACT (NO 2) 1931 (NO. 27, 1931)"
"sta21931281931168/","SALES TAX ACT (NO 2) 1931 (NO. 28, 1931)"
"staa31931291931292/","SALES TAX ASSESSMENT ACT (NO 3) 1931 (NO. 29, 1931)"
"sta31931301931168/","SALES TAX ACT (NO 3) 1931 (NO. 30, 1931)"
"staa41931311931292/","SALES TAX ASSESSMENT ACT (NO 4) 1931 (NO. 31, 1931)"
"sta41931321931168/","SALES TAX ACT (NO 4) 1931 (NO. 32, 1931)"
"staa51931331931292/","SALES TAX ASSESSMENT ACT (NO 5) 1931 (NO. 33, 1931)"
"sta51931341931168/","SALES TAX ACT (NO 5) 1931 (NO. 34, 1931)"
"staa61931351931292/","SALES TAX ASSESSMENT ACT (NO 6) 1931 (NO. 35, 1931)"
"sta61931361931168/","SALES TAX ACT (NO 6) 1931 (NO. 36, 1931)"
"staa71931371931292/","SALES TAX ASSESSMENT ACT (NO 7) 1931 (NO. 37, 1931)"
"sta71931381931168/","SALES TAX ACT (NO 7) 1931 (NO. 38, 1931)"
"staa81931391931292/","SALES TAX ASSESSMENT ACT (NO 8) 1931 (NO. 39, 1931)"
"sta81931401931168/","SALES TAX ACT (NO 8) 1931 (NO. 40, 1931)"
"staa91931411931292/","SALES TAX ASSESSMENT ACT (NO 9) 1931 (NO. 41, 1931)"
"sta91931421931168/","SALES TAX ACT (NO 9) 1931 (NO. 42, 1931)"
"falba1931431931261/","FLAX AND LINSEED BOUNTIES ACT 1931 (NO. 43, 1931)"
"aioaaa1931441931462/","AUSTRALIAN INSTITUTE OF ANATOMY AGREEMENT ACT 1931 (NO. 44, 1931)"
"saeopa1931451931352/","SERVICE AND EXECUTION OF PROCESS ACT 1931 (NO. 45, 1931)"
"iaopa1931461931269/","INVALID AND OLD-AGE PENSIONS ACT 1931 (NO. 46, 1931)"
"fea21931471931221/","FINANCIAL EMERGENCY ACT (NO 2) 1931 (NO. 47, 1931)"
"wba1931481931191/","WHEAT BOUNTY ACT 1931 (NO. 48, 1931)"
"arwa1931491931494/","APPROPRIATION (UNEMPLOYMENT RELIEF WORKS) ACT 1931 (NO. 49, 1931)"
"saaba19271930501931560/","SUPPLEMENTARY APPROPRIATION (WORKS AND BUILDINGS) ACT 1927-1930 (NO. 50, 1931)"
"saa192730511931375/","SUPPLEMENTARY APPROPRIATION ACT 1927-30 (NO. 51, 1931)"
"dcaa21931521931305/","DEBT CONVERSION AGREEMENT ACT (NO 2) 1931 (NO. 52, 1931)"
"ctva1931531931302/","CUSTOMS TARIFF VALIDATION ACT 1931 (NO. 53, 1931)"
"etva1931541931258/","EXCISE TARIFF VALIDATION ACT 1931 (NO. 54, 1931)"
"ctdva1931551931436/","CUSTOMS TARIFF (PRIMAGE DUTIES) VALIDATION ACT 1931 (NO. 55, 1931)"
"ctdva1931561931432/","CUSTOMS TARIFF (SPECIAL DUTIES) VALIDATION ACT 1931 (NO. 56, 1931)"
