"url","name"
"wtaa196311963275/","WOOL TAX ASSESSMENT ACT 1963 (NO. 1, 1963)"
"wta1196321963178/","WOOL TAX ACT (NO. 1) 1963 (NO. 2, 1963)"
"wta2196331963178/","WOOL TAX ACT (NO. 2) 1963 (NO. 3, 1963)"
"sgaa196341963378/","STATES GRANTS (ADDITIONAL ASSISTANCE) ACT 1963 (NO. 4, 1963)"
"sga196351963357/","STATES GRANTS (UNIVERSITIES) ACT 1963 (NO. 5, 1963)"
"la196361963172/","LOAN (HOUSING) ACT 1963 (NO. 6, 1963)"
"ca196371963160/","COPYRIGHT ACT 1963 (NO. 7, 1963)"
"ana196381963175/","AIR NAVIGATION ACT 1963 (NO. 8, 1963)"
"anua196391963384/","AUSTRALIAN NATIONAL UNIVERSITY ACT 1963 (NO. 9, 1963)"
"ct1963101963184/","CUSTOMS TARIFF 1963 (NO. 10, 1963)"
"ctp1963111963287/","CUSTOMS TARIFF (CANADA PREFERENCE) 1963 (NO. 11, 1963)"
"ctzp11963121963391/","CUSTOMS TARIFF (NEW ZEALAND PREFERENCE) (NO. 1) 1963 (NO. 12, 1963)"
"aa2196263131963230/","APPROPRIATION ACT (NO. 2) 1962-63 (NO. 13, 1963)"
"aasa2196263141963419/","APPROPRIATION (WORKS AND SERVICES) ACT (NO. 2) 1962-63 (NO. 14, 1963)"
"pwca1963151963280/","PUBLIC WORKS COMMITTEE ACT 1963 (NO. 15, 1963)"
"pmpba1963161963383/","PROCESSED MILK PRODUCTS BOUNTY ACT 1963 (NO. 16, 1963)"
"ia1963171963143/","INSURANCE ACT 1963 (NO. 17, 1963)"
"cisa1963181963315/","COMMONWEALTH INSCRIBED STOCK ACT 1963 (NO. 18, 1963)"
"aia1963191963257/","ACTS INTERPRETATION ACT 1963 (NO. 19, 1963)"
"aata1963201963373/","AUSTRALIAN ANTARCTIC TERRITORY ACT 1963 (NO. 20, 1963)"
"cia1963211963202/","CHRISTMAS ISLAND ACT 1963 (NO. 21, 1963)"
"cia1963221963225/","COCOS (KEELING) ISLANDS ACT 1963 (NO. 22, 1963)"
"hiamia1963231963277/","HEARD ISLAND AND MCDONALD ISLANDS ACT 1963 (NO. 23, 1963)"
"soga1963241963383/","SEAT OF GOVERNMENT (ADMINISTRATION) ACT 1963 (NO. 24, 1963)"
"sa196364251963151/","SUPPLY ACT 1963-64 (NO. 25, 1963)"
"sasa196364261963340/","SUPPLY (WORKS AND SERVICES) ACT 1963-64 (NO. 26, 1963)"
"panga1963271963204/","PAPUA AND NEW GUINEA ACT 1963 (NO. 27, 1963)"
"ea1963281963107/","EVIDENCE ACT 1963 (NO. 28, 1963)"
"ppa1963291963257/","PARLIAMENTARY PAPERS ACT 1963 (NO. 29, 1963)"
"usncsaa1963301963545/","UNITED STATES NAVAL COMMUNICATION STATION AGREEMENT ACT 1963 (NO. 30, 1963)"
"lnaca1963311963468/","LOAN (AUSTRALIAN NATIONAL AIRLINES COMMISSION) ACT 1963 (NO. 31, 1963)"
"leala1963321963366/","LOAN (QANTAS EMPIRE AIRWAYS LIMITED) ACT 1963 (NO. 32, 1963)"
"ptaa1963331963306/","PAY-ROLL TAX ASSESSMENT ACT 1963 (NO. 33, 1963)"
"itasscaa1963341963576/","INCOME TAX AND SOCIAL SERVICES CONTRIBUTION ASSESSMENT ACT 1963 (NO. 34, 1963)"
"saeopa1963351963352/","SERVICE AND EXECUTION OF PROCESS ACT 1963 (NO. 35, 1963)"
"sgaa21963361963405/","STATES GRANTS (ADDITIONAL ASSISTANCE) ACT (NO. 2) 1963 (NO. 36, 1963)"
"ct21963371963211/","CUSTOMS TARIFF (NO. 2) 1963 (NO. 37, 1963)"
"ctp21963381963314/","CUSTOMS TARIFF (CANADA PREFERENCE) (NO. 2) 1963 (NO. 38, 1963)"
"ctzp21963391963391/","CUSTOMS TARIFF (NEW ZEALAND PREFERENCE) (NO. 2) 1963 (NO. 39, 1963)"
"ctoranp1963401963544/","CUSTOMS TARIFF (FEDERATION OF RHODESIA AND NYASALAND PREFERENCE) 1963 (NO. 40, 1963)"
"et1963411963140/","EXCISE TARIFF 1963 (NO. 41, 1963)"
"ct31963421963211/","CUSTOMS TARIFF (NO. 3) 1963 (NO. 42, 1963)"
"ctzp31963431963391/","CUSTOMS TARIFF (NEW ZEALAND PREFERENCE) (NO. 3) 1963 (NO. 43, 1963)"
"staca1963441963431/","SALES TAX (EXEMPTIONS AND CLASSIFICATIONS) ACT 1963 (NO. 44, 1963)"
"staa51963451963292/","SALES TAX ASSESSMENT ACT (NO. 5) 1963 (NO. 45, 1963)"
"ssa1963461963193/","SOCIAL SERVICES ACT 1963 (NO. 46, 1963)"
"ra1963471963182/","REPATRIATION ACT 1963 (NO. 47, 1963)"
"ca1963481963151/","CUSTOMS ACT 1963 (NO. 48, 1963)"
"ea1963491963107/","EXCISE ACT 1963 (NO. 49, 1963)"
"ioaia1963501963592/","INTERNATIONAL ORGANIZATIONS (PRIVILEGES AND IMMUNITIES) ACT 1963 (NO. 50, 1963)"
"idaa1963511963421/","INTERNATIONAL DEVELOPMENT ASSOCIATION ACT 1963 (NO. 51, 1963)"
"ifca1963521963365/","INTERNATIONAL FINANCE CORPORATION ACT 1963 (NO. 52, 1963)"
"imaa1963531963387/","INTERNATIONAL MONETARY AGREEMENTS ACT 1963 (NO. 53, 1963)"
"whoa1963541963300/","WORLD HEALTH ORGANIZATION ACT 1963 (NO. 54, 1963)"
"lslsa1963551963349/","LOAN (WAR SERVICE LAND SETTLEMENT) ACT 1963 (NO. 55, 1963)"
"la21963561963199/","LOAN (HOUSING) ACT (NO. 2) 1963 (NO. 56, 1963)"
"cba1963571963220/","COMMONWEALTH BANKS ACT 1963 (NO. 57, 1963)"
"sia1963581963297/","STEVEDORING INDUSTRY ACT 1963 (NO. 58, 1963)"
"aa196364591963203/","APPROPRIATION ACT 1963-64 (NO. 59, 1963)"
"aasa196364601963392/","APPROPRIATION (WORKS AND SERVICES) ACT 1963-64 (NO. 60, 1963)"
"scappa1963611963414/","SUBMARINE CABLES AND PIPELINES PROTECTION ACT 1963 (NO. 61, 1963)"
"woma1963621963280/","WINE OVERSEAS MARKETING ACT 1963 (NO. 62, 1963)"
"dpaa1963631963308/","DISABLED PERSONS ACCOMMODATION ACT 1963 (NO. 63, 1963)"
"ca1963641963177/","CRIMES (AIRCRAFT) ACT 1963 (NO. 64, 1963)"
"la196365196386/","LOAN ACT 1963 (NO. 65, 1963)"
"idaca1963661963648/","INTERNATIONAL DEVELOPMENT ASSOCIATION (ADDITIONAL CONTRIBUTION) ACT 1963 (NO. 66, 1963)"
"ca1963671963147/","CURRENCY ACT 1963 (NO. 67, 1963)"
"uaa1963681963366/","UNIVERSITIES (FINANCIAL ASSISTANCE) ACT 1963 (NO. 68, 1963)"
"itasscaa21963691963603/","INCOME TAX AND SOCIAL SERVICES CONTRIBUTION ASSESSMENT ACT (NO. 2) 1963 (NO. 69, 1963)"
"itassca1963701963452/","INCOME TAX AND SOCIAL SERVICES CONTRIBUTION ACT 1963 (NO. 70, 1963)"
"itaa1963711963379/","INCOME TAX (INTERNATIONAL AGREEMENTS) ACT 1963 (NO. 71, 1963)"
"edaa1963721963302/","ESTATE DUTY ASSESSMENT ACT 1963 (NO. 72, 1963)"
"gdaa1963731963276/","GIFT DUTY ASSESSMENT ACT 1963 (NO. 73, 1963)"
"aala1963741963362/","AIR ACCIDENTS (COMMONWEALTH LIABILITY) ACT 1963 (NO. 74, 1963)"
"sga21963751963384/","STATES GRANTS (UNIVERSITIES) ACT (NO. 2) 1963 (NO. 75, 1963)"
"sgaa1963761963357/","STATES GRANTS (SPECIAL ASSISTANCE) ACT 1963 (NO. 76, 1963)"
"nha1963771963174/","NATIONAL HEALTH ACT 1963 (NO. 77, 1963)"
"pfba1963781963374/","PHOSPHATE FERTILIZERS BOUNTY ACT 1963 (NO. 78, 1963)"
"dpeca1963791963357/","DAIRY PRODUCE EXPORT CONTROL ACT 1963 (NO. 79, 1963)"
"dpraspa1963801963437/","DAIRY PRODUCE RESEARCH AND SALES PROMOTION ACT 1963 (NO. 80, 1963)"
"dfa1963811963244/","DEFENCE (VISITING FORCES) ACT 1963 (NO. 81, 1963)"
"bata1963821963285/","BROADCASTING AND TELEVISION ACT 1963 (NO. 82, 1963)"
"wisa1963831963366/","WHEAT INDUSTRY STABILIZATION ACT 1963 (NO. 83, 1963)"
"weca1963841963228/","WHEAT EXPORT CHARGE ACT 1963 (NO. 84, 1963)"
"ota1963851963337/","OVERSEAS TELECOMMUNICATIONS ACT 1963 (NO. 85, 1963)"
"rcba1963861963259/","RAW COTTON BOUNTY ACT 1963 (NO. 86, 1963)"
"wadaa1963871963541/","WESTERN AUSTRALIA (NORTHERN DEVELOPMENT) AGREEMENT ACT 1963 (NO. 87, 1963)"
"vrba1963881963276/","VINYL RESIN BOUNTY ACT 1963 (NO. 88, 1963)"
"cfema1963891963351/","CANNED FRUITS EXPORT MARKETING ACT 1963 (NO. 89, 1963)"
"cfeca1963901963316/","CANNED FRUITS EXPORT CHARGES ACT 1963 (NO. 90, 1963)"
"et21963911963167/","EXCISE TARIFF (NO. 2) 1963 (NO. 91, 1963)"
"cfea1963921963211/","CANNED FRUIT EXCISE ACT 1963 (NO. 92, 1963)"
"cba1963931963206/","COPPER BOUNTY ACT 1963 (NO. 93, 1963)"
"ctva1963941963302/","CUSTOMS TARIFF VALIDATION ACT 1963 (NO. 94, 1963)"
"bwswaa1963951963444/","BLOWERING WATER STORAGE WORKS AGREEMENT ACT 1963 (NO. 95, 1963)"
"smhaa1963961963516/","SNOWY MOUNTAINS HYDRO-ELECTRIC AUTHORITY ACT 1963 (NO. 96, 1963)"
"ana1963971963229/","AIR NAVIGATION (CHARGES) ACT 1963 (NO. 97, 1963)"
"rmwa1963981963285/","RIVER MURRAY WATERS ACT 1963 (NO. 98, 1963)"
"mlsaa1963991963309/","MENINDEE LAKES STORAGE AGREEMENT ACT 1963 (NO. 99, 1963)"
"craa19631001963322/","CHOWILLA RESERVOIR AGREEMENT ACT 1963 (NO. 100, 1963)"
"nia19631011963185/","NORFOLK ISLAND ACT 1963 (NO. 101, 1963)"
"sa19631021963222/","SUPERANNUATION ACT 1963 (NO. 102, 1963)"
"dfrba19631031963332/","DEFENCE FORCES RETIREMENT BENEFITS ACT 1963 (NO. 103, 1963)"
