"url","name"
"mosa196711967244/","MINISTERS OF STATE ACT 1967 (NO. 1, 1967)"
"psa196721967179/","PUBLIC SERVICE ACT 1967 (NO. 2, 1967)"
"slrca196731967422/","STATUTE LAW REVISION (DECIMAL CURRENCY) ACT 1967 (NO. 3, 1967)"
"sica196741967333/","STEVEDORING INDUSTRY CHARGE ACT 1967 (NO. 4, 1967)"
"tgrra196751967341/","TASMANIA GRANT (GORDON RIVER ROAD) ACT 1967 (NO. 5, 1967)"
"lslsa196761967349/","LOAN (WAR SERVICE LAND SETTLEMENT) ACT 1967 (NO. 6, 1967)"
"ct196771967184/","CUSTOMS TARIFF 1967 (NO. 7, 1967)"
"sgla196781967373/","STATES GRANTS (SCIENCE LABORATORIES) ACT 1967 (NO. 8, 1967)"
"sgea2196791967355/","STATES GRANTS (ADVANCED EDUCATION) ACT (NO. 2) 1967 (NO. 9, 1967)"
"ssa1967101967193/","SOCIAL SERVICES ACT 1967 (NO. 10, 1967)"
"naca1967111967320/","NATIONALITY AND CITIZENSHIP ACT 1967 (NO. 11, 1967)"
"sga1967121967199/","STATES GRANTS ACT 1967 (NO. 12, 1967)"
"itpa1967131967255/","INCOME TAX (AGED PERSONS) ACT 1967 (NO. 13, 1967)"
"nha1967141967174/","NATIONAL HEALTH ACT 1967 (NO. 14, 1967)"
"ndsfa1967151967270/","NATIONAL DEBT SINKING FUND ACT 1967 (NO. 15, 1967)"
"dpaia1967161967390/","DIPLOMATIC PRIVILEGES AND IMMUNITIES ACT 1967 (NO. 16, 1967)"
"ct21967171967211/","CUSTOMS TARIFF (NO. 2) 1967 (NO. 17, 1967)"
"et1967181967140/","EXCISE TARIFF 1967 (NO. 18, 1967)"
"itaa1967191967267/","INCOME TAX ASSESSMENT ACT 1967 (NO. 19, 1967)"
"ptaa1967201967306/","PAY-ROLL TAX ASSESSMENT ACT 1967 (NO. 20, 1967)"
"staca1967211967431/","SALES TAX (EXEMPTIONS AND CLASSIFICATIONS) ACT 1967 (NO. 21, 1967)"
"sea1967221967363/","SHELTERED EMPLOYMENT (ASSISTANCE) ACT 1967 (NO. 22, 1967)"
"dia1967231967249/","DAIRYING INDUSTRY ACT 1967 (NO. 23, 1967)"
"pmpba1967241967383/","PROCESSED MILK PRODUCTS BOUNTY ACT 1967 (NO. 24, 1967)"
"aa3196667251967230/","APPROPRIATION ACT (NO. 3) 1966-67 (NO. 25, 1967)"
"aa4196667261967230/","APPROPRIATION ACT (NO. 4) 1966-67 (NO. 26, 1967)"
"atca1967271967388/","AUSTRALIAN TOURIST COMMISSION ACT 1967 (NO. 27, 1967)"
"nla1967281967204/","NATIONAL LIBRARY ACT 1967 (NO. 28, 1967)"
"staca21967291967458/","SALES TAX (EXEMPTIONS AND CLASSIFICATIONS) ACT (NO. 2) 1967 (NO. 29, 1967)"
"tpa1967301967176/","TRADE PRACTICES ACT 1967 (NO. 30, 1967)"
"tgra1967311967256/","TASMANIA GRANT (FIRE RELIEF) ACT 1967 (NO. 31, 1967)"
"wia1967321967231/","WOOL INDUSTRY ACT 1967 (NO. 32, 1967)"
"sgea1967331967328/","STATES GRANTS (ADVANCED EDUCATION) ACT 1967 (NO. 33, 1967)"
"sgca1967341967340/","STATES GRANTS (TEACHERS COLLEGES) ACT 1967 (NO. 34, 1967)"
"auca1967351967431/","AUSTRALIAN UNIVERSITIES COMMISSION ACT 1967 (NO. 35, 1967)"
"sa1196768361967178/","SUPPLY ACT (NO. 1) 1967-68 (NO. 36, 1967)"
"sa2196768371967178/","SUPPLY ACT (NO. 2) 1967-68 (NO. 37, 1967)"
"itaa21967381967294/","INCOME TAX ASSESSMENT ACT (NO. 2) 1967 (NO. 38, 1967)"
"itaa1967391967379/","INCOME TAX (INTERNATIONAL AGREEMENTS) ACT 1967 (NO. 39, 1967)"
"edaa1967401967302/","ESTATE DUTY ASSESSMENT ACT 1967 (NO. 40, 1967)"
"gdaa1967411967276/","GIFT DUTY ASSESSMENT ACT 1967 (NO. 41, 1967)"
"sfaa1967421967372/","SOFTWOOD FORESTRY AGREEMENTS ACT 1967 (NO. 42, 1967)"
"pssa1967431967304/","PETROLEUM SEARCH SUBSIDY ACT 1967 (NO. 43, 1967)"
"smaaa1967441967377/","SUGAR MARKETING ASSISTANCE AGREEMENT ACT 1967 (NO. 44, 1967)"
"ctva1967451967302/","CUSTOMS TARIFF VALIDATION ACT 1967 (NO. 45, 1967)"
"etva1967461967258/","EXCISE TARIFF VALIDATION ACT 1967 (NO. 46, 1967)"
"bata1967471967285/","BROADCASTING AND TELEVISION ACT 1967 (NO. 47, 1967)"
"blaa1967481967251/","BRIGALOW LANDS AGREEMENT ACT 1967 (NO. 48, 1967)"
"anacea1967491967541/","AUSTRALIAN NATIONAL AIRLINES COMMISSION EQUIPMENT ACT 1967 (NO. 49, 1967)"
"hsga1967501967242/","HOMES SAVINGS GRANT ACT 1967 (NO. 50, 1967)"
"iradga1967511967443/","INDUSTRIAL RESEARCH AND DEVELOPMENT GRANTS ACT 1967 (NO. 51, 1967)"
"sa1967521967222/","SUPERANNUATION ACT 1967 (NO. 52, 1967)"
"nda1967531967187/","NARCOTIC DRUGS ACT 1967 (NO. 53, 1967)"
"ca1967541967151/","CUSTOMS ACT 1967 (NO. 54, 1967)"
"ca1967551967395/","CONSTITUTION ALTERATION (ABORIGINALS) 1967 (NO. 55, 1967)"
"ngpaaa1967561967480/","NATURAL GAS PIPELINE (SOUTH AUSTRALIA) AGREEMENT ACT 1967 (NO. 56, 1967)"
"dfpa1967571967250/","DEFENCE FORCE PROTECTION ACT 1967 (NO. 57, 1967)"
"cpa1967581967302/","COMMONWEALTH PRISONERS ACT 1967 (NO. 58, 1967)"
"wta1967591967257/","WIRELESS TELEGRAPHY ACT 1967 (NO. 59, 1967)"
"na1967601967150/","NAVIGATION ACT 1967 (NO. 60, 1967)"
"ssa21967611967220/","SOCIAL SERVICES ACT (NO. 2) 1967 (NO. 61, 1967)"
"patra1967621967271/","POST AND TELEGRAPH RATES ACT 1967 (NO. 62, 1967)"
"patra1967631967343/","POST AND TELEGRAPH REGULATIONS ACT 1967 (NO. 63, 1967)"
"ra1967641967182/","REPATRIATION ACT 1967 (NO. 64, 1967)"
"anua1967651967384/","AUSTRALIAN NATIONAL UNIVERSITY ACT 1967 (NO. 65, 1967)"
"aa1196768661967230/","APPROPRIATION ACT (NO. 1) 1967-68 (NO. 66, 1967)"
"aa2196768671967230/","APPROPRIATION ACT (NO. 2) 1967-68 (NO. 67, 1967)"
"ct31967681967211/","CUSTOMS TARIFF (NO. 3) 1967 (NO. 68, 1967)"
"ct41967691967211/","CUSTOMS TARIFF (NO. 4) 1967 (NO. 69, 1967)"
"ct51967701967211/","CUSTOMS TARIFF (NO. 5) 1967 (NO. 70, 1967)"
"sga21967711967226/","STATES GRANTS ACT (NO. 2) 1967 (NO. 71, 1967)"
"la196772196786/","LOAN ACT 1967 (NO. 72, 1967)"
"sgrma1967731967498/","STATES GRANTS (WATER RESOURCES MEASUREMENT) ACT 1967 (NO. 73, 1967)"
"sghia1967741967483/","STATES GRANTS (MENTAL HEALTH INSTITUTIONS) ACT 1967 (NO. 74, 1967)"
"ba1967751967266/","BANKRUPTCY (VALIDATION) ACT 1967 (NO. 75, 1967)"
"itaa31967761967294/","INCOME TAX ASSESSMENT ACT (NO. 3) 1967 (NO. 76, 1967)"
"ita1967771967143/","INCOME TAX ACT 1967 (NO. 77, 1967)"
"itata1967781967421/","INCOME TAX (PARTNERSHIPS AND TRUSTS) ACT 1967 (NO. 78, 1967)"
"ana1967791967229/","AIR NAVIGATION (CHARGES) ACT 1967 (NO. 79, 1967)"
"staca31967801967458/","SALES TAX (EXEMPTIONS AND CLASSIFICATIONS) ACT (NO. 3) 1967 (NO. 80, 1967)"
"la1967811967172/","LOAN (HOUSING) ACT 1967 (NO. 81, 1967)"
"et21967821967167/","EXCISE TARIFF (NO. 2) 1967 (NO. 82, 1967)"
"apha1967831967215/","AGED PERSONS HOMES ACT 1967 (NO. 83, 1967)"
"ba196784196799/","BANKING ACT 1967 (NO. 84, 1967)"
"itaa41967851967294/","INCOME TAX ASSESSMENT ACT (NO. 4) 1967 (NO. 85, 1967)"
"itaa21967861967406/","INCOME TAX (INTERNATIONAL AGREEMENTS) ACT (NO. 2) 1967 (NO. 86, 1967)"
"itdaia1967871967468/","INCOME TAX (NON-RESIDENT DIVIDENDS AND INTEREST) ACT 1967 (NO. 87, 1967)"
"ptaa21967881967333/","PAY-ROLL TAX ASSESSMENT ACT (NO. 2) 1967 (NO. 88, 1967)"
"da1967891967238/","DEFENCE (RE-ESTABLISHMENT) ACT 1967 (NO. 89, 1967)"
"sia1967901967391/","SUPERANNUATION (PENSION INCREASES) ACT 1967 (NO. 90, 1967)"
"dfrbia1967911967501/","DEFENCE FORCES RETIREMENT BENEFITS (PENSION INCREASES) ACT 1967 (NO. 91, 1967)"
"praa1967921967459/","PARLIAMENTARY RETIRING ALLOWANCES (INCREASES) ACT 1967 (NO. 92, 1967)"
"igaa1967931967354/","INTERNATIONAL GRAINS ARRANGEMENT ACT 1967 (NO. 93, 1967)"
"iwaa1967941967434/","INTERNATIONAL WHEAT AGREEMENT (EXTENSION) ACT 1967 (NO. 94, 1967)"
"saa1967951967188/","SUGAR AGREEMENT ACT 1967 (NO. 95, 1967)"
"ceca1967961967416/","COMMONWEALTH EMPLOYEES' COMPENSATION ACT 1967 (NO. 96, 1967)"
"sca1967971967249/","SEAMEN'S COMPENSATION ACT 1967 (NO. 97, 1967)"
"sgaa1967981967357/","STATES GRANTS (SPECIAL ASSISTANCE) ACT 1967 (NO. 98, 1967)"
"ctva21967991967329/","CUSTOMS TARIFF VALIDATION ACT (NO. 2) 1967 (NO. 99, 1967)"
"nha219671001967201/","NATIONAL HEALTH ACT (NO. 2) 1967 (NO. 100, 1967)"
"caaa19671011967292/","CONCILIATION AND ARBITRATION ACT 1967 (NO. 101, 1967)"
"swpaaa19671021967370/","SEAMEN'S WAR PENSIONS AND ALLOWANCES ACT 1967 (NO. 102, 1967)"
"nia19671031967204/","NAURU INDEPENDENCE ACT 1967 (NO. 103, 1967)"
"ccoaea19671041967302/","CANBERRA COLLEGE OF ADVANCED EDUCATION ACT 1967 (NO. 104, 1967)"
"sgea319671051967355/","STATES GRANTS (ADVANCED EDUCATION) ACT (NO. 3) 1967 (NO. 105, 1967)"
"uaa19671061967366/","UNIVERSITIES (FINANCIAL ASSISTANCE) ACT 1967 (NO. 106, 1967)"
"uaa219671071967393/","UNIVERSITIES (FINANCIAL ASSISTANCE) ACT (NO. 2) 1967 (NO. 107, 1967)"
"da19671081967118/","DESIGNS ACT 1967 (NO. 108, 1967)"
"sipa19671091967565/","STEVEDORING INDUSTRY (TEMPORARY PROVISIONS) ACT 1967 (NO. 109, 1967)"
"sica219671101967360/","STEVEDORING INDUSTRY CHARGE ACT (NO. 2) 1967 (NO. 110, 1967)"
"sicaa19671111967457/","STEVEDORING INDUSTRY CHARGE ASSESSMENT ACT 1967 (NO. 111, 1967)"
"lala19671121967306/","LOAN (QANTAS AIRWAYS LIMITED) ACT 1967 (NO. 112, 1967)"
"lea19671131967276/","LOAN (AIRLINES EQUIPMENT) ACT 1967 (NO. 113, 1967)"
"cefa19671141967384/","COMMONWEALTH EMPLOYEES' FURLOUGH ACT 1967 (NO. 114, 1967)"
"psa219671151967206/","PUBLIC SERVICE ACT (NO. 2) 1967 (NO. 115, 1967)"
"fa19671161967137/","FISHERIES ACT 1967 (NO. 116, 1967)"
"siaa19671171967331/","SUGAR INDUSTRY ASSISTANCE ACT 1967 (NO. 117, 1967)"
"pla19671181967294/","PETROLEUM (SUBMERGED LANDS) ACT 1967 (NO. 118, 1967)"
"pla19671191967403/","PETROLEUM (SUBMERGED LANDS) (ROYALTY) ACT 1967 (NO. 119, 1967)"
"plpfa19671201967538/","PETROLEUM (SUBMERGED LANDS) (EXPLORATION PERMIT FEES) ACT 1967 (NO. 120, 1967)"
"pllfa19671211967494/","PETROLEUM (SUBMERGED LANDS) (PRODUCTION LICENCE FEES) ACT 1967 (NO. 121, 1967)"
"pllfa19671221967447/","PETROLEUM (SUBMERGED LANDS) (PIPELINE LICENCE FEES) ACT 1967 (NO. 122, 1967)"
"plfa19671231967468/","PETROLEUM (SUBMERGED LANDS) (REGISTRATION FEES) ACT 1967 (NO. 123, 1967)"
"pacia19671241967390/","PETROLEUM (ASHMORE AND CARTIER ISLANDS) ACT 1967 (NO. 124, 1967)"
