"url","name"
"anua197111971384/","AUSTRALIAN NATIONAL UNIVERSITY ACT 1971 (NO. 1, 1971)"
"dpa197121971122/","DEFENCE PAY ACT 1971 (NO. 2, 1971)"
"ia197131971248/","IMMIGRATION (EDUCATION) ACT 1971 (NO. 3, 1971)"
"boea197141971175/","BILLS OF EXCHANGE ACT 1971 (NO. 4, 1971)"
"saa197151971188/","SUGAR AGREEMENT ACT 1971 (NO. 5, 1971)"
"itaa197161971267/","INCOME TAX ASSESSMENT ACT 1971 (NO. 6, 1971)"
"cafba197171971312/","CELLULOSE ACETATE FLAKE BOUNTY ACT 1971 (NO. 7, 1971)"
"bata197181971285/","BROADCASTING AND TELEVISION ACT 1971 (NO. 8, 1971)"
"ota197191971337/","OVERSEAS TELECOMMUNICATIONS ACT 1971 (NO. 9, 1971)"
"nswgma1971101971429/","NEW SOUTH WALES GRANT (FLOOD MITIGATION) ACT 1971 (NO. 10, 1971)"
"lwba1971111971279/","LOAN (AUSTRALIAN WHEAT BOARD) ACT 1971 (NO. 11, 1971)"
"ca1971121971151/","CUSTOMS ACT 1971 (NO. 12, 1971)"
"actsca1971131971510/","AUSTRALIAN CAPITAL TERRITORY SUPREME COURT ACT 1971 (NO. 13, 1971)"
"nda1971141971128/","NAVAL DEFENCE ACT 1971 (NO. 14, 1971)"
"cra1971151971246/","CRIMINOLOGY RESEARCH ACT 1971 (NO. 15, 1971)"
"ssa1971161971193/","SOCIAL SERVICES ACT 1971 (NO. 16, 1971)"
"ra1971171971182/","REPATRIATION ACT 1971 (NO. 17, 1971)"
"swpaaa1971181971370/","SEAMEN'S WAR PENSIONS AND ALLOWANCES ACT 1971 (NO. 18, 1971)"
"dfla1971191971230/","DRIED FRUITS LEVY ACT 1971 (NO. 19, 1971)"
"dflca1971201971328/","DRIED FRUITS LEVY COLLECTION ACT 1971 (NO. 20, 1971)"
"dfra1971211971239/","DRIED FRUITS RESEARCH ACT 1971 (NO. 21, 1971)"
"sa1971221971124/","SALARIES ACT 1971 (NO. 22, 1971)"
"aa3197071231971230/","APPROPRIATION ACT (NO. 3) 1970-71 (NO. 23, 1971)"
"aa4197071241971230/","APPROPRIATION ACT (NO. 4) 1970-71 (NO. 24, 1971)"
"ntrea1971251971489/","NORTHERN TERRITORY RAILWAY EXTENSION ACT 1971 (NO. 25, 1971)"
"poopapa1971261971544/","PUBLIC ORDER (PROTECTION OF PERSONS AND PROPERTY) ACT 1971 (NO. 26, 1971)"
"panglba1971271971405/","PAPUA AND NEW GUINEA LOAN (INTERNATIONAL BANK) ACT 1971 (NO. 27, 1971)"
"psla1971281971239/","PIG SLAUGHTER LEVY ACT 1971 (NO. 28, 1971)"
"pslca1971291971337/","PIG SLAUGHTER LEVY COLLECTION ACT 1971 (NO. 29, 1971)"
"pira1971301971268/","PIG INDUSTRY RESEARCH ACT 1971 (NO. 30, 1971)"
"itaa1971311971306/","INTERNATIONAL TIN AGREEMENT ACT 1971 (NO. 31, 1971)"
"sgtca1971321971442/","STATES GRANTS (PRE-SCHOOL TEACHERS COLLEGES) ACT 1971 (NO. 32, 1971)"
"epica1971331971473/","EXPORT PAYMENTS INSURANCE CORPORATION ACT 1971 (NO. 33, 1971)"
"idapa1971341971597/","INTERNATIONAL DEVELOPMENT ASSOCIATION (FURTHER PAYMENT) ACT 1971 (NO. 34, 1971)"
"lala1971351971324/","LOANS (QANTAS AIRWAYS LIMITED) ACT 1971 (NO. 35, 1971)"
"la197136197186/","LOAN ACT 1971 (NO. 36, 1971)"
"sgta1971371971349/","STATES GRANTS (TECHNICAL TRAINING) ACT 1971 (NO. 37, 1971)"
"ct1971381971184/","CUSTOMS TARIFF 1971 (NO. 38, 1971)"
"iwaa1971391971318/","INTERNATIONAL WHEAT AGREEMENT ACT 1971 (NO. 39, 1971)"
"sgaa1971401971385/","STATES GRANTS (HOUSING ASSISTANCE) ACT 1971 (NO. 40, 1971)"
"sa1197172411971178/","SUPPLY ACT (NO. 1) 1971-72 (NO. 41, 1971)"
"sa2197172421971178/","SUPPLY ACT (NO. 2) 1971-72 (NO. 42, 1971)"
"mosa1971431971244/","MINISTERS OF STATE ACT 1971 (NO. 43, 1971)"
"sga1971441971357/","STATES GRANTS (UNIVERSITIES) ACT 1971 (NO. 44, 1971)"
"ctva1971451971302/","CUSTOMS TARIFF VALIDATION ACT 1971 (NO. 45, 1971)"
"sa1971461971222/","SUPERANNUATION ACT 1971 (NO. 46, 1971)"
"dfrba1971471971332/","DEFENCE FORCES RETIREMENT BENEFITS ACT 1971 (NO. 47, 1971)"
"cea1971481971416/","COMPENSATION (COMMONWEALTH EMPLOYEES) ACT 1971 (NO. 48, 1971)"
"usncsea1971491971643/","UNITED STATES NAVAL COMMUNICATION STATION (CIVILIAN EMPLOYEES) ACT 1971 (NO. 49, 1971)"
"aala1971501971362/","AIR ACCIDENTS (COMMONWEALTH LIABILITY) ACT 1971 (NO. 50, 1971)"
"ataa1971511971368/","ANGLO-AUSTRALIAN TELESCOPE AGREEMENT ACT 1971 (NO. 51, 1971)"
"sca1971521971249/","SEAMEN'S COMPENSATION ACT 1971 (NO. 52, 1971)"
"wia1971531971231/","WOOL INDUSTRY ACT 1971 (NO. 53, 1971)"
"itaa21971541971294/","INCOME TAX ASSESSMENT ACT (NO. 2) 1971 (NO. 54, 1971)"
"itda1971551971289/","INCOME TAX (BEARER DEBENTURES) ACT 1971 (NO. 55, 1971)"
"ittra1971561971423/","INCOME TAX (WITHHOLDING TAX RECOUPMENT) ACT 1971 (NO. 56, 1971)"
"tpa1971571971176/","TRADE PRACTICES ACT 1971 (NO. 57, 1971)"
"panga1971581971204/","PAPUA AND NEW GUINEA ACT 1971 (NO. 58, 1971)"
"sica1971591971333/","STEVEDORING INDUSTRY CHARGE ACT 1971 (NO. 59, 1971)"
"sicaa1971601971457/","STEVEDORING INDUSTRY CHARGE ASSESSMENT ACT 1971 (NO. 60, 1971)"
"sgra1971611971444/","STATES GRANTS (RURAL RECONSTRUCTION) ACT 1971 (NO. 61, 1971)"
"ldaa1971621971303/","LOAN (FARMERS' DEBT ADJUSTMENT) ACT 1971 (NO. 62, 1971)"
"vgpcla1971631971582/","VICTORIA GRANT (SHEPPARTON PRESERVING COMPANY LIMITED) ACT 1971 (NO. 63, 1971)"
"sga1971641971199/","STATES GRANTS ACT 1971 (NO. 64, 1971)"
"sgla1971651971373/","STATES GRANTS (SCIENCE LABORATORIES) ACT 1971 (NO. 65, 1971)"
"actepa1971661971675/","AUSTRALIAN CAPITAL TERRITORY EVIDENCE (TEMPORARY PROVISIONS) ACT 1971 (NO. 66, 1971)"
"ssa21971671971220/","SOCIAL SERVICES ACT (NO. 2) 1971 (NO. 67, 1971)"
"ra21971681971209/","REPATRIATION ACT (NO. 2) 1971 (NO. 68, 1971)"
"swpaaa21971691971397/","SEAMEN'S WAR PENSIONS AND ALLOWANCES ACT (NO. 2) 1971 (NO. 69, 1971)"
"pata1971701971213/","POST AND TELEGRAPH ACT 1971 (NO. 70, 1971)"
"patra1971711971271/","POST AND TELEGRAPH RATES ACT 1971 (NO. 71, 1971)"
"bata21971721971312/","BROADCASTING AND TELEVISION ACT (NO. 2) 1971 (NO. 72, 1971)"
"sia1971731971391/","SUPERANNUATION (PENSION INCREASES) ACT 1971 (NO. 73, 1971)"
"dfrbia1971741971501/","DEFENCE FORCES RETIREMENT BENEFITS (PENSION INCREASES) ACT 1971 (NO. 74, 1971)"
"praa1971751971459/","PARLIAMENTARY RETIRING ALLOWANCES (INCREASES) ACT 1971 (NO. 75, 1971)"
"ptocta1971761971500/","PAY-ROLL TAX (TERMINATION OF COMMONWEALTH TAX) ACT 1971 (NO. 76, 1971)"
"ptaa1971771971451/","PAY-ROLL TAX (TERRITORIES) ASSESSMENT ACT 1971 (NO. 77, 1971)"
"pta1971781971327/","PAY-ROLL TAX (TERRITORIES) ACT 1971 (NO. 78, 1971)"
"ana1971791971175/","AIR NAVIGATION ACT 1971 (NO. 79, 1971)"
"nsa1971801971200/","NATIONAL SERVICE ACT 1971 (NO. 80, 1971)"
"aapsa1971811971289/","APPLE AND PEAR STABILIZATION ACT 1971 (NO. 81, 1971)"
"aapseda1971821971447/","APPLE AND PEAR STABILIZATION EXPORT DUTY ACT 1971 (NO. 82, 1971)"
"aapsedca1971831971545/","APPLE AND PEAR STABILIZATION EXPORT DUTY COLLECTION ACT 1971 (NO. 83, 1971)"
"aapoa1971841971282/","APPLE AND PEAR ORGANIZATION ACT 1971 (NO. 84, 1971)"
"nha1971851971174/","NATIONAL HEALTH ACT 1971 (NO. 85, 1971)"
"pfba1971861971374/","PHOSPHATE FERTILIZERS BOUNTY ACT 1971 (NO. 86, 1971)"
"lsla1971871971317/","LIVE-STOCK SLAUGHTER LEVY ACT 1971 (NO. 87, 1971)"
"raaa1971881971399/","RAILWAY AGREEMENT (WESTERN AUSTRALIA) ACT 1971 (NO. 88, 1971)"
"wpa1971891971287/","WOOL (DEFICIENCY PAYMENTS) ACT 1971 (NO. 89, 1971)"
"sa3197172901971178/","SUPPLY ACT (NO. 3) 1971-72 (NO. 90, 1971)"
"epica21971911971500/","EXPORT PAYMENTS INSURANCE CORPORATION ACT (NO. 2) 1971 (NO. 91, 1971)"
"ita1971921971143/","INCOME TAX ACT 1971 (NO. 92, 1971)"
"itaa31971931971294/","INCOME TAX ASSESSMENT ACT (NO. 3) 1971 (NO. 93, 1971)"
"lala21971941971351/","LOANS (QANTAS AIRWAYS LIMITED) ACT (NO. 2) 1971 (NO. 94, 1971)"
"saba1971951971270/","SULPHURIC ACID BOUNTY ACT 1971 (NO. 95, 1971)"
"pba1971961971244/","PYRITES BOUNTY ACT 1971 (NO. 96, 1971)"
"warwsaa1971971971691/","WESTERN AUSTRALIA (SOUTH-WEST REGION WATER SUPPLIES) AGREEMENT ACT 1971 (NO. 97, 1971)"
"actsca21971981971537/","AUSTRALIAN CAPITAL TERRITORY SUPREME COURT ACT (NO. 2) 1971 (NO. 98, 1971)"
"ntsca1971991971453/","NORTHERN TERRITORY SUPREME COURT ACT 1971 (NO. 99, 1971)"
"sia19711001971297/","STEVEDORING INDUSTRY ACT 1971 (NO. 100, 1971)"
"raa19711011971279/","RAILWAY AGREEMENT (TASMANIA) ACT 1971 (NO. 101, 1971)"
"mca19711021971224/","MATRIMONIAL CAUSES ACT 1971 (NO. 102, 1971)"
"la19711031971121/","LOAN (DEFENCE) ACT 1971 (NO. 103, 1971)"
"pttocaa19711041971621/","PAY-ROLL TAX (STATE TAXATION OF COMMONWEALTH AUTHORITIES) ACT 1971 (NO. 104, 1971)"
"dfta119711051971205/","DIESEL FUEL TAX ACT (NO. 1) 1971 (NO. 105, 1971)"
"dfta219711061971205/","DIESEL FUEL TAX ACT (NO. 2) 1971 (NO. 106, 1971)"
"ct219711071971211/","CUSTOMS TARIFF (NO. 2) 1971 (NO. 107, 1971)"
"et19711081971140/","EXCISE TARIFF 1971 (NO. 108, 1971)"
"ct319711091971211/","CUSTOMS TARIFF (NO. 3) 1971 (NO. 109, 1971)"
"eiga19711101971305/","EXPORT INCENTIVE GRANTS ACT 1971 (NO. 110, 1971)"
"sga19711111971285/","STATES GRANTS (HOUSING) ACT 1971 (NO. 111, 1971)"
"hsga19711121971242/","HOMES SAVINGS GRANT ACT 1971 (NO. 112, 1971)"
"sgea19711131971328/","STATES GRANTS (ADVANCED EDUCATION) ACT 1971 (NO. 113, 1971)"
"sgsla19711141971462/","STATES GRANTS (SECONDARY SCHOOLS LIBRARIES) ACT 1971 (NO. 114, 1971)"
"sga219711151971384/","STATES GRANTS (UNIVERSITIES) ACT (NO. 2) 1971 (NO. 115, 1971)"
"acoaea19711161971429/","AUSTRALIAN COMMISSION ON ADVANCED EDUCATION ACT 1971 (NO. 116, 1971)"
"auca19711171971431/","AUSTRALIAN UNIVERSITIES COMMISSION ACT 1971 (NO. 117, 1971)"
"aa11971721181971230/","APPROPRIATION ACT (NO. 1) 1971-72 (NO. 118, 1971)"
"aa21971721191971230/","APPROPRIATION ACT (NO. 2) 1971-72 (NO. 119, 1971)"
"wsha19711201971216/","WAR SERVICE HOMES ACT 1971 (NO. 120, 1971)"
"lslsa19711211971349/","LOAN (WAR SERVICE LAND SETTLEMENT) ACT 1971 (NO. 121, 1971)"
"sgaa19711221971357/","STATES GRANTS (SPECIAL ASSISTANCE) ACT 1971 (NO. 122, 1971)"
"pnga19711231971188/","PAPUA NEW GUINEA ACT 1971 (NO. 123, 1971)"
"ctva219711241971329/","CUSTOMS TARIFF VALIDATION ACT (NO. 2) 1971 (NO. 124, 1971)"
"aa31971721251971230/","APPROPRIATION ACT (NO. 3) 1971-72 (NO. 125, 1971)"
"tba19711261971137/","TARIFF BOARD ACT 1971 (NO. 126, 1971)"
"sagca19711271971422/","SOUTH AUSTRALIA GRANT (FRUIT CANNERIES) ACT 1971 (NO. 127, 1971)"
"nswgccla19711281971596/","NEW SOUTH WALES GRANT (LEETON CO-OPERATIVE CANNERY LIMITED) ACT 1971 (NO. 128, 1971)"
"sgaa19711291971354/","STATES GRANTS (CAPITAL ASSISTANCE) ACT 1971 (NO. 129, 1971)"
"sgaa19711301971368/","STATES GRANTS (ABORIGINAL ADVANCEMENT) ACT 1971 (NO. 130, 1971)"
"dvfla19711311971276/","DRIED VINE FRUITS LEVY ACT 1971 (NO. 131, 1971)"
"dvflca19711321971374/","DRIED VINE FRUITS LEVY COLLECTION ACT 1971 (NO. 132, 1971)"
"dvfsa19711331971360/","DRIED VINE FRUITS STABILIZATION ACT 1971 (NO. 133, 1971)"
"ca219711341971178/","CUSTOMS ACT (NO. 2) 1971 (NO. 134, 1971)"
"sga219711351971226/","STATES GRANTS ACT (NO. 2) 1971 (NO. 135, 1971)"
"soaa19711361971447/","SALARIES (STATUTORY OFFICES) ADJUSTMENT ACT 1971 (NO. 136, 1971)"
"jaa19711371971271/","JUDICIAL APPOINTMENT (FIJI) ACT 1971 (NO. 137, 1971)"
"rtpa19711381971313/","RESTRICTIVE TRADE PRACTICES ACT 1971 (NO. 138, 1971)"
