"url","name"
"staca196111961431/","SALES TAX (EXEMPTIONS AND CLASSIFICATIONS) ACT 1961 (NO. 1, 1961)"
"sta1196121961168/","SALES TAX ACT (NO. 1) 1961 (NO. 2, 1961)"
"sta2196131961168/","SALES TAX ACT (NO. 2) 1961 (NO. 3, 1961)"
"sta3196141961168/","SALES TAX ACT (NO. 3) 1961 (NO. 4, 1961)"
"sta4196151961168/","SALES TAX ACT (NO. 4) 1961 (NO. 5, 1961)"
"sta5196161961168/","SALES TAX ACT (NO. 5) 1961 (NO. 6, 1961)"
"sta6196171961168/","SALES TAX ACT (NO. 6) 1961 (NO. 7, 1961)"
"sta7196181961168/","SALES TAX ACT (NO. 7) 1961 (NO. 8, 1961)"
"sta8196191961168/","SALES TAX ACT (NO. 8) 1961 (NO. 9, 1961)"
"sta91961101961168/","SALES TAX ACT (NO. 9) 1961 (NO. 10, 1961)"
"ntsca1961111961453/","NORTHERN TERRITORY SUPREME COURT ACT 1961 (NO. 11, 1961)"
"ma1961121961112/","MARRIAGE ACT 1961 (NO. 12, 1961)"
"jpa1961131961211/","JUDGES' PENSIONS ACT 1961 (NO. 13, 1961)"
"epica1961141961473/","EXPORT PAYMENTS INSURANCE CORPORATION ACT 1961 (NO. 14, 1961)"
"dfrba1961151961332/","DEFENCE FORCES RETIREMENT BENEFITS ACT 1961 (NO. 15, 1961)"
"nha1961161961174/","NATIONAL HEALTH ACT 1961 (NO. 16, 1961)"
"itasscaa1961171961576/","INCOME TAX AND SOCIAL SERVICES CONTRIBUTION ASSESSMENT ACT 1961 (NO. 17, 1961)"
"ctasa1961181961396/","CUSTOMS TARIFF (DUMPING AND SUBSIDIES) ACT 1961 (NO. 18, 1961)"
"cea1961191961134/","COAL EXCISE ACT 1961 (NO. 19, 1961)"
"sgmilsla1961201961566/","STATES GRANTS (COAL MINING INDUSTRY LONG SERVICE LEAVE) ACT 1961 (NO. 20, 1961)"
"et1961211961140/","EXCISE TARIFF 1961 (NO. 21, 1961)"
"ct1961221961184/","CUSTOMS TARIFF 1961 (NO. 22, 1961)"
"ctp1961231961287/","CUSTOMS TARIFF (CANADA PREFERENCE) 1961 (NO. 23, 1961)"
"ctzp11961241961391/","CUSTOMS TARIFF (NEW ZEALAND PREFERENCE) (NO. 1) 1961 (NO. 24, 1961)"
"woma1961251961280/","WINE OVERSEAS MARKETING ACT 1961 (NO. 25, 1961)"
"cea1961261961260/","COMMONWEALTH ELECTORAL ACT 1961 (NO. 26, 1961)"
"itasscaa21961271961603/","INCOME TAX AND SOCIAL SERVICES CONTRIBUTION ASSESSMENT ACT (NO. 2) 1961 (NO. 27, 1961)"
"ptaa1961281961306/","PAY-ROLL TAX ASSESSMENT ACT 1961 (NO. 28, 1961)"
"lia1961291961171/","LIFE INSURANCE ACT 1961 (NO. 29, 1961)"
"aa2196061301961230/","APPROPRIATION ACT (NO. 2) 1960-61 (NO. 30, 1961)"
"haa1961311961213/","HOUSING AGREEMENT ACT 1961 (NO. 31, 1961)"
"bata1961321961285/","BROADCASTING AND TELEVISION ACT 1961 (NO. 32, 1961)"
"cafba1961331961312/","CELLULOSE ACETATE FLAKE BOUNTY ACT 1961 (NO. 33, 1961)"
"dpa1961341961122/","DEFENCE PAY ACT 1961 (NO. 34, 1961)"
"aasa2196061351961419/","APPROPRIATION (WORKS AND SERVICES) ACT (NO. 2) 1960-61 (NO. 35, 1961)"
"sa196162361961151/","SUPPLY ACT 1961-62 (NO. 36, 1961)"
"sasa196162371961340/","SUPPLY (WORKS AND SERVICES) ACT 1961-62 (NO. 37, 1961)"
"csla1961381961372/","COMMONWEALTH SERUM LABORATORIES ACT 1961 (NO. 38, 1961)"
"sia1961391961297/","STEVEDORING INDUSTRY ACT 1961 (NO. 39, 1961)"
"caaa1961401961292/","CONCILIATION AND ARBITRATION ACT 1961 (NO. 40, 1961)"
"wta11961411961178/","WOOL TAX ACT (NO. 1) 1961 (NO. 41, 1961)"
"wta21961421961178/","WOOL TAX ACT (NO. 2) 1961 (NO. 42, 1961)"
"wtaa1961431961275/","WOOL TAX ASSESSMENT ACT 1961 (NO. 43, 1961)"
"famda1961441961243/","FOOT AND MOUTH DISEASE ACT 1961 (NO. 44, 1961)"
"ssa1961451961193/","SOCIAL SERVICES ACT 1961 (NO. 45, 1961)"
"ra1961461961182/","REPATRIATION ACT 1961 (NO. 46, 1961)"
"swpaaa1961471961370/","SEAMEN'S WAR PENSIONS AND ALLOWANCES ACT 1961 (NO. 47, 1961)"
"cslca1961481961363/","CATTLE SLAUGHTER LEVY COLLECTION ACT 1961 (NO. 48, 1961)"
"csla1961491961406/","CATTLE SLAUGHTER LEVY (SUSPENSION) ACT 1961 (NO. 49, 1961)"
"cabra1961501961202/","CATTLE AND BEEF RESEARCH ACT 1961 (NO. 50, 1961)"
"ct21961511961211/","CUSTOMS TARIFF (NO. 2) 1961 (NO. 51, 1961)"
"ctp21961521961314/","CUSTOMS TARIFF (CANADA PREFERENCE) (NO. 2) 1961 (NO. 52, 1961)"
"ctoranp1961531961544/","CUSTOMS TARIFF (FEDERATION OF RHODESIA AND NYASALAND PREFERENCE) 1961 (NO. 53, 1961)"
"ctzp21961541961391/","CUSTOMS TARIFF (NEW ZEALAND PREFERENCE) (NO. 2) 1961 (NO. 54, 1961)"
"et21961551961167/","EXCISE TARIFF (NO. 2) 1961 (NO. 55, 1961)"
"ctzp31961561961391/","CUSTOMS TARIFF (NEW ZEALAND PREFERENCE) (NO. 3) 1961 (NO. 56, 1961)"
"cafba21961571961339/","CELLULOSE ACETATE FLAKE BOUNTY ACT (NO. 2) 1961 (NO. 57, 1961)"
"aa196162581961203/","APPROPRIATION ACT 1961-62 (NO. 58, 1961)"
"aasa196162591961392/","APPROPRIATION (WORKS AND SERVICES) ACT 1961-62 (NO. 59, 1961)"
"la1961601961172/","LOAN (HOUSING) ACT 1961 (NO. 60, 1961)"
"qa1961611961158/","QUARANTINE ACT 1961 (NO. 61, 1961)"
"bfgasrpa1961621961495/","BEACHES, FISHING GROUNDS AND SEA ROUTES PROTECTION ACT 1961 (NO. 62, 1961)"
"la1961631961180/","LIGHTHOUSES ACT 1961 (NO. 63, 1961)"
"pata1961641961213/","POST AND TELEGRAPH ACT 1961 (NO. 64, 1961)"
"ea1961651961184/","EXPLOSIVES ACT 1961 (NO. 65, 1961)"
"giaa1961661961364/","GOLD-MINING INDUSTRY ASSISTANCE ACT 1961 (NO. 66, 1961)"
"raaa1961671961399/","RAILWAY AGREEMENT (WESTERN AUSTRALIA) ACT 1961 (NO. 67, 1961)"
"nta1961681961443/","NORTHERN TERRITORY (ADMINISTRATION) ACT 1961 (NO. 68, 1961)"
"ifca1961691961365/","INTERNATIONAL FINANCE CORPORATION ACT 1961 (NO. 69, 1961)"
"aaa1961701961224/","AIRLINES AGREEMENTS ACT 1961 (NO. 70, 1961)"
"anaa1961711961311/","AUSTRALIAN NATIONAL AIRLINES ACT 1961 (NO. 71, 1961)"
"ana1961721961175/","AIR NAVIGATION ACT 1961 (NO. 72, 1961)"
"wsha1961731961216/","WAR SERVICE HOMES ACT 1961 (NO. 73, 1961)"
"pssa1961741961304/","PETROLEUM SEARCH SUBSIDY ACT 1961 (NO. 74, 1961)"
"cba1961751961220/","COMMONWEALTH BANKS ACT 1961 (NO. 75, 1961)"
"staca21961761961458/","SALES TAX (EXEMPTIONS AND CLASSIFICATIONS) ACT (NO. 2) 1961 (NO. 76, 1961)"
"sta11961771961168/","SALES TAX ACT (NO. 1A) 1961 (NO. 77, 1961)"
"sta21961781961168/","SALES TAX ACT (NO. 2A) 1961 (NO. 78, 1961)"
"sta31961791961168/","SALES TAX ACT (NO. 3A) 1961 (NO. 79, 1961)"
"sta41961801961168/","SALES TAX ACT (NO. 4A) 1961 (NO. 80, 1961)"
"sta51961811961168/","SALES TAX ACT (NO. 5A) 1961 (NO. 81, 1961)"
"sta61961821961168/","SALES TAX ACT (NO. 6A) 1961 (NO. 82, 1961)"
"sta71961831961168/","SALES TAX ACT (NO. 7A) 1961 (NO. 83, 1961)"
"sta81961841961168/","SALES TAX ACT (NO. 8A) 1961 (NO. 84, 1961)"
"sta91961851961168/","SALES TAX ACT (NO. 9A) 1961 (NO. 85, 1961)"
"sia1961861961391/","SUPERANNUATION (PENSION INCREASES) ACT 1961 (NO. 86, 1961)"
"dfrbia1961871961501/","DEFENCE FORCES RETIREMENT BENEFITS (PENSION INCREASES) ACT 1961 (NO. 87, 1961)"
"sgaa1961881961357/","STATES GRANTS (SPECIAL ASSISTANCE) ACT 1961 (NO. 88, 1961)"
"aa196189196198/","AUDIT ACT 1961 (NO. 89, 1961)"
"qgcra1961901961326/","QUEENSLAND GRANT (BEEF CATTLE ROADS) ACT 1961 (NO. 90, 1961)"
"wagcra1961911961414/","WESTERN AUSTRALIA GRANT (BEEF CATTLE ROADS) ACT 1961 (NO. 91, 1961)"
"raa1961921961311/","RAILWAY AGREEMENT (QUEENSLAND) ACT 1961 (NO. 92, 1961)"
"clwaswa1961931961462/","COAL LOADING WORKS AGREEMENT (NEW SOUTH WALES) ACT 1961 (NO. 93, 1961)"
"itasscaa31961941961603/","INCOME TAX AND SOCIAL SERVICES CONTRIBUTION ASSESSMENT ACT (NO. 3) 1961 (NO. 94, 1961)"
"itassca1961951961452/","INCOME TAX AND SOCIAL SERVICES CONTRIBUTION ACT 1961 (NO. 95, 1961)"
"na1961961961150/","NAVIGATION ACT 1961 (NO. 96, 1961)"
"ctva1961971961302/","CUSTOMS TARIFF VALIDATION ACT 1961 (NO. 97, 1961)"
"reaaa1961981961491/","RAILWAY EQUIPMENT AGREEMENT (SOUTH AUSTRALIA) ACT 1961 (NO. 98, 1961)"
